{
  "$schema": "./score_v3_prospective_manifest.schema.json",
  "manifest_version": 1,
  "study": "usd_impact_score_v3_descriptive_research_2026-08-24",
  "research_only": true,
  "production_change": false,
  "predictive_claim": false,
  "append_only": true,
  "locked_preregistration_commit_sha": "bf49152fa6005edd20b770db287924d56cfa7499",
  "prospective_holdout_start": "2026-08-28",
  "minimum_completed_weeks_before_selection": 52,
  "interim_review_weeks": [
    13,
    26,
    39
  ],
  "candidate_ids": [
    "V3_E52",
    "V3_R260",
    "V3_MAD260",
    "V3_GRP_MAD260"
  ],
  "initialization": {
    "matrix_file": "score_v3_initialization_2026-08-21.csv",
    "manifest_file": "score_v3_initialization_2026-08-21.manifest.json",
    "matrix_sha256": "6e17100c061cebc3116fdac9c83708b94a72165957ffbcf688d9a08e9d280580",
    "cutoff_week": "2026-08-21",
    "historical_data_status": "retrospective_current_vintage_not_as_published",
    "generated_at_utc": "2026-08-24T17:35:21+00:00",
    "generator_commit_sha": "5dfb55650590228fefb54f50eb8093cd620bba78"
  },
  "entries": [
    {
      "week": "2026-08-28",
      "ingested_at_utc": "2026-08-29T22:07:44.573064+00:00",
      "source_v2_bundle_sha256": "60f75ec0265d159c92e5584f425a1a881e2b4c3799bed43cb8f5bb40c188a96b",
      "source_v2_pipeline_commit_sha": "5bc1a6bb1575b7a8d9268219bb72bcdf42d974b6",
      "source_v2_attestation_status": "passed",
      "locked_preregistration_commit_sha": "bf49152fa6005edd20b770db287924d56cfa7499",
      "initialization_matrix_sha256": "6e17100c061cebc3116fdac9c83708b94a72165957ffbcf688d9a08e9d280580",
      "candidate_result_file": "score_v3_shadow_2026-08-28.json",
      "candidate_result_sha256": "dc2ebab40b8ef8a8005c981a3469bc520a577966b1c98837dccc4b27d7b71eb7"
    },
    {
      "week": "2026-09-04",
      "ingested_at_utc": "2026-09-05T18:36:14.565340+00:00",
      "source_v2_bundle_sha256": "4f20d492a749defe0123c15d4880ecbecc3285b90264e7c4807648b388ecce01",
      "source_v2_pipeline_commit_sha": "58ae75e09d9ab7abfdb896afc77cbe7fe745c6c9",
      "source_v2_attestation_status": "passed",
      "locked_preregistration_commit_sha": "bf49152fa6005edd20b770db287924d56cfa7499",
      "initialization_matrix_sha256": "6e17100c061cebc3116fdac9c83708b94a72165957ffbcf688d9a08e9d280580",
      "candidate_result_file": "score_v3_shadow_2026-09-04.json",
      "candidate_result_sha256": "82e6f2c13bd4ce47f0359773a12999a9afcbd74f8faae2395b3d8068fdefc197"
    },
    {
      "week": "2026-09-11",
      "ingested_at_utc": "2026-09-12T01:31:52.046940+00:00",
      "source_v2_bundle_sha256": "ca33e68f3de9757e5cff7eca9be862660539d5ec51601de664227c9a4ef17fcf",
      "source_v2_pipeline_commit_sha": "babd002436dd083a54b26cd47b9c77b082c73436",
      "source_v2_attestation_status": "passed",
      "locked_preregistration_commit_sha": "bf49152fa6005edd20b770db287924d56cfa7499",
      "initialization_matrix_sha256": "6e17100c061cebc3116fdac9c83708b94a72165957ffbcf688d9a08e9d280580",
      "candidate_result_file": "score_v3_shadow_2026-09-11.json",
      "candidate_result_sha256": "f9fdcbcbbade51ff7fe65ffbab541e1e62fe0559ddc714a6310965d14f4a0fd9"
    },
    {
      "week": "2026-09-18",
      "ingested_at_utc": "2026-09-19T16:36:55.415677+00:00",
      "source_v2_bundle_sha256": "27bbc0417c2632523b9de2bd0765e398ada2fccca8b7ab86596101905367d520",
      "source_v2_pipeline_commit_sha": "4f1f18a33e456af9c5acb6a97eb66f67284b51b1",
      "source_v2_attestation_status": "passed",
      "locked_preregistration_commit_sha": "bf49152fa6005edd20b770db287924d56cfa7499",
      "initialization_matrix_sha256": "6e17100c061cebc3116fdac9c83708b94a72165957ffbcf688d9a08e9d280580",
      "candidate_result_file": "score_v3_shadow_2026-09-18.json",
      "candidate_result_sha256": "6453823143c648a33263c41a3b590dd44b19c63d099f8795878e19574d980d09"
    },
    {
      "week": "2026-09-25",
      "ingested_at_utc": "2026-09-26T11:55:02.442660+00:00",
      "source_v2_bundle_sha256": "f5ac7607580d405a15ae45c608a883f7af56e05bb477a1e97aee2355311ccd83",
      "source_v2_pipeline_commit_sha": "831f48f27c03d15b454e79886635e9c9537fd482",
      "source_v2_attestation_status": "passed",
      "locked_preregistration_commit_sha": "bf49152fa6005edd20b770db287924d56cfa7499",
      "initialization_matrix_sha256": "6e17100c061cebc3116fdac9c83708b94a72165957ffbcf688d9a08e9d280580",
      "candidate_result_file": "score_v3_shadow_2026-09-25.json",
      "candidate_result_sha256": "8ca50d6fcd56406d925e2daf2452b70b29b28c1a8edeb3263ed0fd16e5d54794"
    },
    {
      "week": "2026-10-02",
      "ingested_at_utc": "2026-10-03T13:21:44.931417+00:00",
      "source_v2_bundle_sha256": "9a85df9ee1a3c14b11cb463b03b2b0c8d0bd0559fd929efbfd18e906a63c9ac0",
      "source_v2_pipeline_commit_sha": "05df45d423db48f86d05744b19f663124ba10964",
      "source_v2_attestation_status": "passed",
      "locked_preregistration_commit_sha": "bf49152fa6005edd20b770db287924d56cfa7499",
      "initialization_matrix_sha256": "6e17100c061cebc3116fdac9c83708b94a72165957ffbcf688d9a08e9d280580",
      "candidate_result_file": "score_v3_shadow_2026-10-02.json",
      "candidate_result_sha256": "86cbf2ac506c63c93c24d1a1c1d8d300daac7b1248116b26f225017fe742f21e"
    },
    {
      "week": "2026-10-09",
      "ingested_at_utc": "2026-10-10T12:11:13.019668+00:00",
      "source_v2_bundle_sha256": "7ac594d4ed7df544ea41944fa80208bdf936b8b1b865048636ba1a5ded30c60d",
      "source_v2_pipeline_commit_sha": "aed97276b0fd1f36135c5ab3f78718458d67c934",
      "source_v2_attestation_status": "passed",
      "locked_preregistration_commit_sha": "bf49152fa6005edd20b770db287924d56cfa7499",
      "initialization_matrix_sha256": "6e17100c061cebc3116fdac9c83708b94a72165957ffbcf688d9a08e9d280580",
      "candidate_result_file": "score_v3_shadow_2026-10-09.json",
      "candidate_result_sha256": "b4bed425b51ec3f46bc3bd8d21a6b1a17160b1773dc6b19dc554b8d4a2fef9f5"
    },
    {
      "week": "2026-10-16",
      "ingested_at_utc": "2026-10-17T10:45:18.863869+00:00",
      "source_v2_bundle_sha256": "82458aaf73fb5a82fec5b68498e71b03c758cf15be2f58a58df17b3468403628",
      "source_v2_pipeline_commit_sha": "0be6a771e984a09b4ca1793c762f296a7d4dc2ca",
      "source_v2_attestation_status": "passed",
      "locked_preregistration_commit_sha": "bf49152fa6005edd20b770db287924d56cfa7499",
      "initialization_matrix_sha256": "6e17100c061cebc3116fdac9c83708b94a72165957ffbcf688d9a08e9d280580",
      "candidate_result_file": "score_v3_shadow_2026-10-16.json",
      "candidate_result_sha256": "06d8f94292c2842097e10447fad7c18d62b47f7d847172690cceb22a895516aa"
    }
  ]
}
